{
  "asm_version": "0.3",
  "service_id": "hubspot/crm@v3",
  "taxonomy": "tool.business.crm",
  "display_name": "HubSpot CRM",
  "provenance": {
    "source_url": "https://www.hubspot.com",
    "retrieved_at": "2026-04-28T00:00:00Z",
    "last_verified_at": "2026-04-28T00:00:00Z",
    "verification_status": "self_reported",
    "notes": "Initial provenance backfill from the provider URL; pricing, SLA, and quality claims require source-level review before marking manual_verified."
  },
  "updated_at": "2026-04-14T00:00:00Z",
  "ttl": 86400,
  "provider": {
    "name": "HubSpot",
    "url": "https://www.hubspot.com"
  },
  "capabilities": {
    "description": "Free CRM with contacts, deals, and pipeline management — track customer relationships and automate outreach",
    "input_modalities": [
      "structured_data"
    ],
    "output_modalities": [
      "structured_data"
    ],
    "supported_languages": [
      "en"
    ]
  },
  "pricing": {
    "billing_dimensions": [
      {
        "dimension": "api_call",
        "unit": "per_contact",
        "cost_per_unit": 0,
        "currency": "USD"
      }
    ],
    "free_tier": "Free for up to 1M contacts"
  },
  "quality": {
    "metrics": []
  },
  "sla": {
    "latency_p50": "200ms",
    "latency_p99": "800ms",
    "uptime": 0.999,
    "rate_limit": "varies"
  },
  "payment": {
    "methods": [
      "free_tier",
      "onchain_usdc"
    ],
    "auth_type": "api_key",
    "signup_url": "https://www.hubspot.com",
    "onchain_address": "0x3de20Bf87EB178F20f015189d0a9a01d537f549C",
    "onchain_network": "eip155:5042002"
  },
  "extensions": {
    "tool": {
      "supports_pipeline": true,
      "supports_automation": true,
      "supports_email_tracking": true
    }
  }
}
