{
  "asm_version": "0.3",
  "service_id": "google/tasks-api@v1",
  "taxonomy": "tool.productivity.todo",
  "display_name": "Google Tasks",
  "provenance": {
    "source_url": "https://workspace.google.com",
    "retrieved_at": "2026-04-28T00:00:00Z",
    "last_verified_at": "2026-04-28T00:00:00Z",
    "verification_status": "self_reported",
    "notes": "Initial provenance backfill from the provider URL; pricing, SLA, and quality claims require source-level review before marking manual_verified."
  },
  "updated_at": "2026-04-14T00:00:00Z",
  "ttl": 86400,
  "provider": {
    "name": "Google",
    "url": "https://workspace.google.com",
    "verified_by": [
      "google-cloud-marketplace"
    ]
  },
  "capabilities": {
    "description": "Simple task management integrated with Gmail and Google Calendar — create, organize, and complete tasks",
    "input_modalities": [
      "structured_data"
    ],
    "output_modalities": [
      "structured_data"
    ],
    "supported_languages": [
      "en",
      "zh",
      "ja",
      "ko",
      "fr",
      "de",
      "es"
    ]
  },
  "pricing": {
    "billing_dimensions": [
      {
        "dimension": "api_call",
        "unit": "per_1",
        "cost_per_unit": 0,
        "currency": "USD"
      }
    ],
    "free_tier": "unlimited tasks"
  },
  "quality": {
    "metrics": [
      {
        "name": "G2_Rating",
        "score": 4.2,
        "scale": "5.0",
        "benchmark": "G2 Crowd Reviews",
        "evaluated_at": "2026-03-01",
        "self_reported": false
      }
    ]
  },
  "sla": {
    "latency_p50": "200ms",
    "latency_p99": "800ms",
    "uptime": 0.9995,
    "rate_limit": "1500 req/min"
  },
  "payment": {
    "methods": [
      "free_tier",
      "google_workspace",
      "onchain_usdc"
    ],
    "auth_type": "oauth2",
    "signup_url": "https://workspace.google.com",
    "onchain_address": "0x82C23955a94bA6BCe870e67aC47d080be3b50299",
    "onchain_network": "eip155:5042002"
  },
  "extensions": {
    "tool": {
      "supports_webhooks": false,
      "supports_recurring_tasks": true,
      "supports_reminders": true,
      "supports_collaboration": false,
      "mobile_apps": true,
      "integrations": [
        "gmail",
        "google_calendar"
      ]
    }
  }
}
