{
  "asm_version": "0.3",
  "service_id": "browserbase/api@v1",
  "taxonomy": "tool.automation.browser",
  "display_name": "Browserbase",
  "provenance": {
    "source_url": "https://browserbase.com",
    "retrieved_at": "2026-04-28T00:00:00Z",
    "last_verified_at": "2026-04-28T00:00:00Z",
    "verification_status": "self_reported",
    "notes": "Initial provenance backfill from the provider URL; pricing, SLA, and quality claims require source-level review before marking manual_verified."
  },
  "updated_at": "2026-04-14T00:00:00Z",
  "ttl": 3600,
  "provider": {
    "name": "Browserbase",
    "url": "https://browserbase.com"
  },
  "capabilities": {
    "description": "Headless browser infrastructure for AI agents — navigate, click, scrape, and automate web workflows at scale",
    "input_modalities": [
      "structured_data",
      "text"
    ],
    "output_modalities": [
      "structured_data",
      "file",
      "text"
    ]
  },
  "pricing": {
    "billing_dimensions": [
      {
        "dimension": "browser_minute",
        "unit": "per_1",
        "cost_per_unit": 0.01,
        "currency": "USD"
      }
    ],
    "free_tier": "100 minutes/month"
  },
  "quality": {
    "metrics": [
      {
        "name": "Success_Rate",
        "score": 0.96,
        "scale": "1.0",
        "benchmark": "Internal benchmark",
        "evaluated_at": "2026-03-01",
        "self_reported": true
      }
    ]
  },
  "sla": {
    "latency_p50": "2s",
    "latency_p99": "8s",
    "uptime": 0.998,
    "rate_limit": "50 concurrent sessions"
  },
  "payment": {
    "methods": [
      "free_tier",
      "stripe",
      "onchain_usdc"
    ],
    "auth_type": "api_key",
    "signup_url": "https://browserbase.com",
    "onchain_address": "0x52CBd6295A7813e50aa8FA3A3E2b8148A01bD6a1",
    "onchain_network": "eip155:5042002"
  },
  "extensions": {
    "tool": {
      "supports_stealth_mode": true,
      "supports_proxy": true,
      "supports_screenshots": true,
      "supports_pdf_export": true,
      "playwright_compatible": true,
      "integrations": [
        "playwright",
        "puppeteer",
        "selenium"
      ]
    }
  }
}
