{
  "asm_version": "0.3",
  "service_id": "deepl/translate@v2",
  "taxonomy": "ai.nlp.translation",
  "display_name": "DeepL Translate",
  "provenance": {
    "source_url": "https://www.deepl.com",
    "retrieved_at": "2026-04-28T00:00:00Z",
    "last_verified_at": "2026-04-28T00:00:00Z",
    "verification_status": "self_reported",
    "notes": "Initial provenance backfill from the provider URL; pricing, SLA, and quality claims require source-level review before marking manual_verified."
  },
  "updated_at": "2026-04-14T00:00:00Z",
  "ttl": 86400,
  "provider": {
    "name": "DeepL",
    "url": "https://www.deepl.com"
  },
  "capabilities": {
    "description": "Neural machine translation — 33 languages with context-aware accuracy that outperforms Google Translate",
    "input_modalities": [
      "text"
    ],
    "output_modalities": [
      "text"
    ],
    "supported_languages": [
      "en"
    ]
  },
  "pricing": {
    "billing_dimensions": [
      {
        "dimension": "api_call",
        "unit": "per_character",
        "cost_per_unit": 0.00002,
        "currency": "USD"
      }
    ],
    "free_tier": "500K characters/month free"
  },
  "quality": {
    "metrics": []
  },
  "sla": {
    "latency_p50": "200ms",
    "latency_p99": "600ms",
    "uptime": 0.999,
    "rate_limit": "varies"
  },
  "payment": {
    "methods": [
      "free_tier",
      "stripe",
      "onchain_usdc"
    ],
    "auth_type": "api_key",
    "signup_url": "https://www.deepl.com",
    "onchain_address": "0x3B720a048CF91d011B696040a952e0754f921af4",
    "onchain_network": "eip155:5042002"
  },
  "extensions": {
    "tool": {
      "languages": 33,
      "supports_glossaries": true,
      "supports_formality": true
    }
  }
}
