{
  "asm_version": "0.3",
  "service_id": "airtable/api@v1",
  "taxonomy": "tool.productivity.spreadsheet",
  "display_name": "Airtable",
  "provenance": {
    "source_url": "https://airtable.com",
    "retrieved_at": "2026-04-28T00:00:00Z",
    "last_verified_at": "2026-04-28T00:00:00Z",
    "verification_status": "self_reported",
    "notes": "Initial provenance backfill from the provider URL; pricing, SLA, and quality claims require source-level review before marking manual_verified."
  },
  "updated_at": "2026-04-14T00:00:00Z",
  "ttl": 86400,
  "provider": {
    "name": "Airtable",
    "url": "https://airtable.com"
  },
  "capabilities": {
    "description": "Spreadsheet-database hybrid — structured data with views, automations, and rich field types",
    "input_modalities": [
      "structured_data"
    ],
    "output_modalities": [
      "structured_data"
    ],
    "supported_languages": [
      "en"
    ]
  },
  "pricing": {
    "billing_dimensions": [
      {
        "dimension": "api_call",
        "unit": "per_record",
        "cost_per_unit": 0,
        "currency": "USD"
      }
    ],
    "free_tier": "1000 records/base free"
  },
  "quality": {
    "metrics": []
  },
  "sla": {
    "latency_p50": "120ms",
    "latency_p99": "500ms",
    "uptime": 0.999,
    "rate_limit": "varies"
  },
  "payment": {
    "methods": [
      "free_tier",
      "onchain_usdc"
    ],
    "auth_type": "api_key",
    "signup_url": "https://airtable.com",
    "onchain_address": "0x53d11edF5B0B7a447431FAF42260f22BEA9FFB66",
    "onchain_network": "eip155:5042002"
  },
  "extensions": {
    "tool": {
      "supports_automations": true,
      "supports_views": true,
      "supports_attachments": true
    }
  }
}
