{
  "asm_version": "0.3",
  "service_id": "e2b/sandbox@v1",
  "taxonomy": "infra.compute.sandbox",
  "display_name": "E2B Code Sandbox",
  "provenance": {
    "source_url": "https://e2b.dev",
    "retrieved_at": "2026-04-28T00:00:00Z",
    "last_verified_at": "2026-04-28T00:00:00Z",
    "verification_status": "self_reported",
    "notes": "Initial provenance backfill from the provider URL; pricing, SLA, and quality claims require source-level review before marking manual_verified."
  },
  "updated_at": "2026-04-14T00:00:00Z",
  "ttl": 86400,
  "provider": {
    "name": "E2B",
    "url": "https://e2b.dev"
  },
  "capabilities": {
    "description": "Cloud sandboxes for AI-generated code execution — run Python, JS, Bash safely with filesystem and networking",
    "input_modalities": [
      "text"
    ],
    "output_modalities": [
      "text",
      "structured_data"
    ],
    "supported_languages": [
      "en"
    ]
  },
  "pricing": {
    "billing_dimensions": [
      {
        "dimension": "api_call",
        "unit": "per_second",
        "cost_per_unit": 0.0001,
        "currency": "USD"
      }
    ],
    "free_tier": "100 sandbox hours/month free"
  },
  "quality": {
    "metrics": []
  },
  "sla": {
    "latency_p50": "800ms",
    "latency_p99": "3s",
    "uptime": 0.998,
    "rate_limit": "varies"
  },
  "payment": {
    "methods": [
      "free_tier",
      "stripe",
      "onchain_usdc"
    ],
    "auth_type": "api_key",
    "signup_url": "https://e2b.dev",
    "onchain_address": "0xd67f2408C1Df1bCEbC88d7c22398a0f27EC65402",
    "onchain_network": "eip155:5042002"
  },
  "extensions": {
    "tool": {
      "supports_python": true,
      "supports_js": true,
      "supports_bash": true,
      "sandboxed": true
    }
  }
}
